146,Kennedy,2023-06-29,"""What Is Affirmative Action? What Is the Equal Protection Clause?""",Here is a brief history of the terms and how they have been used.,The New York Times,Politics,No,14.54248359224446,94.31497210192974,87.88922107178391,53.91398365075465,74.3722513440117,81.07063387606563,action equal,{},{'history': 'brief'},0,1
147,Kennedy,2023-06-29,"""R.F.K. Jr. Is a Walking, Talking Conspiracy Theory""","R.F.K. Jr. is a walking, talking conspiracy theory.",The New York Times,Business,No,14.54248359224446,60.96328443402133,33.06733364618001,53.91398365075465,74.3722513440117,81.07063387606563,r.f.k. jr.,{},{},0,1
148,Kennedy,2023-06-29,"""SCOTUS enters the 2024 chat""",Welcome to The Hill's Campaign newsletter {beacon} Campaign Report Campaign Report The Big Story SCOTUS enters the 2024 chat The Supreme Court's pivotal decision on Thursday striking down affirmative action policies at Harvard and the University of North Carolina at Chapel Hill are already galvanizing Democrats and Republicans alike ahead of a crucial 2024...,The Hill,Top,No,14.54248359224446,98.29049944321066,87.74553563391657,53.91398365075465,74.3722513440117,81.07063387606563,scotus chat,{},"{'decision': 'pivotal', 'action': 'affirmative'}",0,1
149,Kennedy,2023-06-29,"""Column: RFK Jr.'s town hall showed the folly of trying to fact-check quackery in real time""",The Fox News wannabe News Nation gave Robert F. Kennedy Jr. a 90-minute platform Wednesday. But why?,L.a. Times,Business,No,14.54248359224446,99.90982296957267,99.9648707587172,53.91398365075465,74.3722513440117,81.07063387606563,column rfk,{'time': 'real'},{},0,1
150,Kennedy,2023-06-30,"""Trump, DeSantis among 2024 GOP hopefuls set to appear at Moms for Liberty gathering""","PHILADELPHIA (AP) — Former President Donald Trump and Florida Gov. Ron DeSantis, the main rivals for the Republican presidential nomination, are scheduled to speak Friday at the annual gathering of Moms for Liberty, a two-year-old group that has fiercely opposed instruction related to race and gender identity in the nation's classroom. The group, which has [...]",Knwa Fox24,Top,No,14.57597593923096,65.81314625625991,56.54568061554784,54.7146288884981,66.43134652783093,61.47242628800051,trump desantis,{},"{'rivals': 'main', 'nomination': 'presidential', 'gathering': 'annual', 'group': 'old'}",1,0
151,Kennedy,2023-06-30,"""The Hill's Morning Report — Affirmative action ruling triggers frenzy; student loans up next""","A conservative majority on the Supreme Court blasted through decades of precedent Thursday to put an end to affirmative action in university admissions and is expected today to conclude the term by blocking President Biden’s program to forgive student loan debts. Since last year, right-leaning justices have issued constitutional reinterpretations that are reshaping cultural, privacy...",The Hill,Top,No,14.57597593923096,84.17621548530965,26.103978713624077,54.7146288884981,66.43134652783093,61.47242628800051,hill morning,{'ruling': 'affirmative'},"{'majority': 'conservative', 'action': 'affirmative', 'year': 'last', 'justices': 'leaning', 'reinterpretations': 'constitutional', 'privacy': 'cultural'}",1,0
152,Kennedy,2023-06-30,"""RFK Jr.'s anti-vaxx views also reinforce damaging autism stereotypes, advocates say""","RFK Jr. says he advocates for the marginalized, but built his career spreading harmful lies about autistic people",Salon,Health,No,14.57597593923096,95.690088097218,99.68327274429345,54.7146288884981,66.43134652783093,61.47242628800051,rfk jr.,"{'views': 'vaxx', 'stereotypes': 'damaging'}","{'lies': 'harmful', 'people': 'autistic'}",1,0
153,Kennedy,2023-06-30,"""RFK Jr. knocks Biden over student loan ruling""","Democratic presidential candidate Robert F. Kennedy, Jr. took a jab at his primary opponent, President Biden, over the Supreme Court’s decision Friday to shoot down Biden's student loan forgiveness plan. “The unfortunate SCOTUS ruling striking down President Biden's student loan forgiveness program was the predictable result of Biden's failure to bring Congress together on this...",The Hill,Top,No,14.57597593923096,71.15483168887825,99.28315704703142,54.7146288884981,66.43134652783093,61.47242628800051,rfk jr.,{},"{'candidate': 'presidential', 'opponent': 'primary', 'ruling': 'unfortunate', 'result': 'predictable'}",1,0
154,Kennedy,2023-06-30,"""Five takeaways on the Supreme Court's student debt decision""","The Supreme Court on Friday struck down President Biden’s student debt relief plan, with the court’s six conservatives ruling the administration did not have the power to forgive loans for more than 40 million borrowers. The decision is a major win for Republicans who declared the plan unfair and balked at the $400 billion price...",The Hill,Top,No,14.57597593923096,93.6941738103658,17.00507315691501,54.7146288884981,66.43134652783093,61.47242628800051,takeaways supreme,{},{'win': 'major'},1,0
155,Kennedy,2023-06-30,"""Robert F. Kennedy Jr. and the Coalition of the Distrustful""",The people who believe he is going to save America.,The New York Times,Business,No,14.57597593923096,47.14189642773381,79.77200198269581,54.7146288884981,66.43134652783093,61.47242628800051,robert f.,{},{},1,0
156,Kennedy,2023-07-01,"""Robert Kennedy Jr. Reports Income of $7.8 Million""","The presidential candidate and anti-vaccine activist made nearly $1.6 million from consulting work for a law firm known for litigation against pharmaceutical companies, a filing showed.",The New York Times,Politics,No,14.60731840156392,67.84440180636312,87.02169563698904,55.46388044785144,56.841780491226366,89.99341844286457,robert kennedy,{},"{'candidate': 'presidential', 'activist': 'vaccine', 'companies': 'pharmaceutical'}",1,0
157,Kennedy,2023-07-01,"""Elena Kagan Has Had Enough""",Her dissent on the student loan decision is revealing.,The New York Times,Business,No,14.60731840156392,99.38469126506293,90.1883681045212,55.46388044785144,56.841780491226366,89.99341844286457,elena kagan,{},{},1,0
158,Kennedy,2023-07-01,"""How RFK Jr. Brought In More Than $9 Million Over The Past 18 Months""",The presidential hopeful and his A-list wife don’t get much of their income from the Kennedy family.,Forbes,Business,Yes,14.60731840156392,69.85041017991036,93.61706366589895,55.46388044785144,56.841780491226366,89.99341844286457,rfk jr.,{'months': 'past'},{'hopeful': 'presidential'},1,0
159,Kennedy,2023-07-01,"""Marianne Williamson names third campaign manager since launching 2024 bid""","Democratic presidential candidate Marianne Williamson announced her third campaign manager Friday as her campaign has been rocked by multiple staff shake ups. Carlos Cardona, her former New Hampshire state director, will lead the campaign. The news comes just before Williamson begins a speaking tour in New Hampshire and Massachusetts. “The decision to promote Carlos Cardona...",The Hill,Top,No,14.60731840156392,41.38140207581783,90.7483836588419,55.46388044785144,56.841780491226366,89.99341844286457,marianne williamson,{'manager': 'third'},"{'candidate': 'presidential', 'manager': 'third', 'ups': 'multiple', 'director': 'former', 'tour': 'speaking'}",1,0
160,Kennedy,2023-07-02,"""Swole The Vote: Why Politicians Love Doing Pushups""","Hypermasculinity on the campaign trail is often a way to deflect questions about age, though some politicians just like getting ripped.",Huffpost,Politics,No,14.636869031739248,89.3697666077327,99.37967544757682,56.17029768793713,91.33210665872598,99.58324320146879,swole vote,{'vote': 'swole'},{},1,1
161,Kennedy,2023-07-02,"""Rising: July 2, 2023""","CNN's Jake Tapper shuts down RFK Jr Town Hall over candidates 'dangerous' childhood vaccine views Briahna Joy Gray and Robby Soave discuss NewsNation's town hall with RFK Jr. Originally aired June 28, 2023; https://www.youtube.com/watch?v=hYFospPc6EE According to the CDC, all COVID-19 vaccines currently available in the United States are effective at preventing COVID-19. Getting sick with...",The Hill,Top,No,14.636869031739248,97.79085411162406,99.78570802763772,56.17029768793713,91.33210665872598,99.58324320146879,july,{},"{'vaccine': 'dangerous', 'vaccines': 'available'}",1,1
162,Kennedy,2023-07-03,"""Democrats' new primary calendar remains unresolved. The party insists that's OK""","Months after the Democratic Party approved President Biden's plan to overhaul its primary order to better reflect a deeply diverse voter base, implementing the revamped order has proven anything but simple.","The Washington Times , America’s Newspaper",Top,No,14.662010654672,97.90956726865616,67.06198564825873,56.77131620355097,81.97142215364012,86.64434026794433,democrats calendar,{'calendar': 'primary'},"{'order': 'revamped', 'base': 'diverse'}",1,0
163,Kennedy,2023-07-03,"""Democrats' new primary calendar remains unresolved. The party insists that's OK""",New Hampshire is in open rebellion,Abc News,Top,No,14.662010654672,97.90956726865616,96.46597672372718,56.77131620355097,81.97142215364012,86.64434026794433,democrats calendar,{'calendar': 'primary'},{'rebellion': 'open'},1,0
164,Kennedy,2023-07-03,"""Rising: July 3, 2023""","MSM ANNOYED At RFK JR DOUBLE DIGIT Polling, New Poll Shows 17% Support: Brie & Robby Briahna Joy Gray and Robby Soave react to a new Democratic primary poll from Fox News that shows Robert F. Kennedy Jr.'s number continues to inch up. #RFK #JoeBiden WATCH: Dana Carvey, David Spade ROAST Fauci Over Covid-19 Vaccines:...",The Hill,Top,No,14.662010654672,98.33983369394176,99.93847882104006,56.77131620355097,81.97142215364012,86.64434026794433,july,{},{'poll': 'primary'},1,0
165,Kennedy,2023-07-03,"""Williamson torches DNC's 'outrageous' support for Biden in 2024 Dem primary""",2024 candidate Marianne Williamson targets President Biden and the Democratic national committee over a lack of primary debates; paints contrasts with Robert F. Kennedy Jr.,Fox News,Top,No,14.662010654672,41.41014151933466,73.61789178945499,56.77131620355097,81.97142215364012,86.64434026794433,williamson dnc,{'support': 'outrageous'},{'debates': 'primary'},1,0
166,Kennedy,2023-07-03,"""Joe Rogan says trans women competing in women's sports has become 'forced compliance:' 'Just f---ing stop'""","Joe Rogan gave his strong opinion on trans women competing in women's sports, saying that at this point it has become 'forced compliance.'",Fox News,Top,No,14.662010654672,99.8117883384834,98.83989491232096,56.77131620355097,81.97142215364012,86.64434026794433,women joe,{'compliance': 'forced'},"{'opinion': 'strong', 'compliance': 'forced'}",1,0
167,Kennedy,2023-07-04,"""Rising: July 4, 2023""",JULY 4 POLL: Extreme Pride In Being An American Stays Low Per Gallup Briahna Joy Gray and Robby Soave react to polling on American pride. #4thofJuly #patriotism MSNBC'S Mehdi Hasan FREAKS Over CNN's RFK Jr Workout POST: 'Did CNN Rehire CHRIS LICHT'?! Jessica Burbank and Amber Athey react to MSNBC Mehdi Hasan's comments about Robert...,The Hill,Top,No,14.685236021173823,98.0535515218809,99.72383879674848,57.32652599795643,37.77242374665325,83.00740148049648,july,{},{'pride': 'american'},1,0
168,Kennedy,2023-07-04,"""Robert F. Kennedy Jr. Celebrates Free Speech Ruling: 'Happy Independence Day'""",Democratic presidential candidate Robert F. Kennedy Jr. celebrated a federal judge's decision to block the Biden administration from interacting with social media companies that have censored him and others.,Brietbart,Top,No,14.685236021173823,14.676790094782756,67.67614128027901,57.32652599795643,37.77242374665325,83.00740148049648,robert f.,{},"{'candidate': 'presidential', 'judge': 'federal', 'media': 'social'}",1,0
169,Kennedy,2023-07-05,"""2024 candidates converge on Iowa, New Hampshire for July 4th parades""","Candidates vying for the White House in 2024 were on the campaign trail for Independence Day, meeting voters all over key early-voting states Iowa and New Hampshire. Merrimack, N.H., drew the best turnout among candidates with three Republicans in the town of 25,000 — Florida Gov. Ron DeSantis, Rep. Will Hurd (Texas) and Sen. Tim...",The Hill,Top,No,14.706627757465055,94.01867956190227,95.90311674501832,57.83790227730593,93.69278686069697,88.58335505474733,candidates iowa,{'parades': '4th'},"{'states': 'voting', 'turnout': 'best'}",1,1
170,Kennedy,2023-07-05,"""The D.N.C. Has a Primary Problem""",The White House wanted South Carolina to vote first in 2024. The Democratic National Committee obliged. It hasn’t gone according to plan.,The New York Times,Politics,No,14.706627757465055,98.8698210847053,99.79486539391677,57.83790227730593,93.69278686069697,88.58335505474733,d.n.c. primary,{},{},1,1
171,Kennedy,2023-07-05,"""Rising: July 5, 2023""","July 4 mass shootings in Philadelphia, DC, Tampa; most dangerous day in the US? Briahna Joy Gray and Robby Soave discuss the spike in violence that took place over the July 4 holiday. #fourthofjuly #shootings Cocaine found in the White House, is it linked to Hunter? Brie & Robby react Briahna Joy Gray and Robby...",The Hill,Top,No,14.706627757465055,98.39532725112788,78.40422991110273,57.83790227730593,93.69278686069697,88.58335505474733,july,{},{'day': 'dangerous'},1,1
172,Kennedy,2023-07-05,"""Marianne Williamson Criticizes DNC For Not Holding Debates""","Presidential Democratic Candidate Marianne Williamson says if the party doesn't force the hand as far as debates, ""the democratic principle"" is no more.",International Business Times,Politics,No,14.706627757465055,94.67911269150808,74.15207949025995,57.83790227730593,93.69278686069697,88.58335505474733,marianne williamson,{},{'principle': 'democratic'},1,1
173,Kennedy,2023-07-05,"""'America First' policies transcend Republican-Democratic paradigm""","The emergence of two dissenting voices on opposite sides of the political aisle -- former President Donald Trump and Robert F. Kennedy Jr. -- spotlight how ""America First"" policies defy the current political establishment.","The Washington Times , America’s Newspaper",World,No,14.706627757465055,90.14002674932972,96.95959837207712,57.83790227730593,93.69278686069697,88.58335505474733,america first,{'paradigm': 'democratic'},"{'voices': 'dissenting', 'sides': 'opposite', 'aisle': 'political', 'establishment': 'political'}",1,1
174,Kennedy,2023-07-06,"""Bill Ackman Says 'Huge Loss' If This Wall Street Titan Does Not Run In 2024 Presidential Race""",read more,Benzinga,Top,No,14.719609833185482,99.7167915012574,96.96807163628812,58.14824293828661,55.07531072553289,93.07205676718804,bill ackman,{},{},1,0
175,Kennedy,2023-07-06,"""Kennedy, Christie and the Supreme Court: Are They Changing the Race?""",A painful ruling from the court can sometimes free a party from an unpopular stance.,The New York Times,Politics,No,14.719609833185482,60.478218121014464,85.91841902811903,58.14824293828661,55.07531072553289,93.07205676718804,kennedy christie,{},"{'ruling': 'painful', 'stance': 'unpopular'}",1,0
176,Kennedy,2023-07-06,"""RFK Jr.'s campaign hauls in $3 million in three days""",Anti-vaccine activist Robert F. Kennedy Jr.'s presidential campaign announced on Thursday that the candidate had hauled in $3 million a three-day stretch alone before the second-quarter filing deadline. Kennedy's campaign said it had brought in an average of $1 million per day over June 28-30. The three-day total represents an impressive figure for a Democratic...,The Hill,Top,Yes,14.719609833185482,15.757132446975248,80.2101153492101,58.14824293828661,55.07531072553289,93.07205676718804,rfk jr.,{},"{'activist': 'vaccine', 'campaign': 'presidential', 'quarter': 'second', 'figure': 'impressive'}",1,0
177,Kennedy,2023-07-06,"""RFK Jr.'s campaign hauls in $3 million in three days""",Anti-vaccine activist Robert F. Kennedy Jr.'s presidential campaign announced Thursday that the candidate had hauled in $3 million in a three-day stretch alone before the second-quarter filing deadline. Kennedy's campaign said it had brought in an average of $1 million per day from June 28-30. The three-day total represents an impressive figure for a Democratic [...],Knwa Fox24,Top,Yes,14.719609833185482,15.757132446975248,89.42558229687866,58.14824293828661,55.07531072553289,93.07205676718804,rfk jr.,{},"{'activist': 'vaccine', 'campaign': 'presidential', 'quarter': 'second', 'figure': 'impressive'}",1,0
178,Kennedy,2023-07-06,"""Rising: July 6, 2023""",Zuckerberg’s Twitter rival Threads already accused of censoring conservatives Briahna Joy Gray and Robby Soave react to the launch of Meta's new Twitter-rival platform. #Threads #Musk Robby Soave: Liberal media outraged that judge would dare block Biden’s censorship powers Robby Soave weighs in on a federal judge's ruling curtailing communication between the Biden administration and...,The Hill,Top,No,14.719609833185482,98.22315370603076,96.91257535624317,58.14824293828661,55.07531072553289,93.07205676718804,july,{},"{'conservatives': 'censoring', 'platform': 'new', 'media': 'liberal', 'judge': 'federal'}",1,0
179,Kennedy,2023-07-06,"""5 Noteworthy Falsehoods Robert F. Kennedy Jr. Has Promoted""","A longtime vaccine skeptic, Mr. Kennedy is leaning heavily on misinformation as he mounts a long-shot 2024 campaign.",The New York Times,Politics,Yes,14.719609833185482,77.17573912574446,94.45457262223528,58.14824293828661,55.07531072553289,93.07205676718804,noteworthy falsehoods,{},"{'vaccine': 'longtime', 'campaign': 'shot'}",1,0
180,Kennedy,2023-07-06,"""Ron DeSantis’s Campaign of Contempt""","Rather than trying to lift people up, he seems to be running on contempt.",The New York Times,Business,No,14.719609833185482,98.31255334826476,99.8881313091913,58.14824293828661,55.07531072553289,93.07205676718804,ron desantis,{},{},1,0
181,Kennedy,2023-07-06,"""Florida GOP requiring loyalty pledge for 2024 candidates""","{beacon} Evening Report Thursday, July 6 © The Hill/Greg Nash Florida GOP requiring loyalty pledge for 2024 The Florida Republican Party says presidential candidates will have to sign a pledge to support the party's eventual nominee in order to appear on the state's Republican primary ballot. The party's two leading candidates, former President Trump...",The Hill,Top,No,14.719609833185482,86.73127520008481,97.45562037856048,58.14824293828661,55.07531072553289,93.07205676718804,florida gop,{},"{'candidates': 'leading', 'nominee': 'eventual', 'ballot': 'primary'}",1,0
182,Kennedy,2023-07-06,"""The Rich Are Crazier Than You and Me""",Why does Silicon Valley love RFK Jr.?,The New York Times,Business,No,14.719609833185482,63.338396721765946,98.8609220495698,58.14824293828661,55.07531072553289,93.07205676718804,rich,{},{},1,0
183,Kennedy,2023-07-07,"""Twitter Star Journos ‘Cautiously’ Move Over to Threads""","Photo Illustration by Kelly Caminero / The Daily Beast / GettyThreads, Meta’s almost-unabashed Twitter clone, has achieved in two days what countless other alternatives have failed: widespread adoption among celebrities, brands, and news organizations alike.Among those who’ve joined have been scores of journalists who previously made names for themselves on Twitter and perhaps fall under all three categories. While Twitter-aping revivals including Bluesky, Mastodon, Post News, Hive Social, and Substack Notes have sputtered out of relevance, Threads has garnered an astonishing 48 million sign-ups within 24 hours, according to The Verge. Its rise has even prompted Twitter to send a cease-and-desist letter to the company, arguing Threads is predicated on Twitter’s trade secrets.But the rise of yet another social platform vying for users disaffected by the Elon Musk version of Twitter has forced those in media who spent the past decade cultivating their own, sometimes massive followings on the now-crumbling platform to try and rebuild those audiences from scratch. It’s a tall ask—even as Threads allows users to migrate their Instagram following—leading some prominent journalists who’ve joined Threads to wonder whether it’s worth it at all.Read more at The Daily Beast.",The Daily Beast,Top,No,15.75484424910959,98.26051617858444,99.70976069629592,82.89585185897134,60.4878802770173,90.14128709930878,twitter star,{},"{'alternatives': 'other', 'adoption': 'widespread', 'revivals': 'aping', 'ups': 'astonishing', 'platform': 'crumbling', 'decade': 'past', 'followings': 'massive', 'ask': 'tall', 'journalists': 'prominent'}",1,1
184,Kennedy,2023-07-07,"""Here’s Why Many Believe Gavin Newsom Is Running For President—Even As He Denies It""",Newsom has dismissed suggestions he’s preparing to challenge President Joe Biden for the 2024 Democratic nomination.,Forbes,Business,No,15.75484424910959,58.23625449106129,98.04408017676234,82.89585185897134,60.4878802770173,90.14128709930878,gavin newsom,{},{'nomination': 'democratic'},1,1
185,Kennedy,2023-07-07,"""RFK Jr.’s campaign is getting a boost from Biden’s hawkishness""",Kennedy is making headway with denunciations of President Biden’s slide into fervent militarism.,The Hill,Politics,Yes,15.75484424910959,84.10162209820422,84.36643147157555,82.89585185897134,60.4878802770173,90.14128709930878,rfk jr.,{},{'militarism': 'fervent'},1,1
186,Kennedy,2023-07-07,"""Ocasio-Cortez backs Biden for reelection""","Rep. Alexandria Ocasio-Cortez (D-N.Y.), one of the most vocal progressives on Capitol Hill, has backed President Biden’s reelection bid. Ocasio-Cortez told the ""Pod Save America"" podcast on Thursday that she would support Biden, who faces two long-shot challengers in the 2024 Democratic primary. “I believe, given that field, yes,” Ocasio-Cortez said when asked whether she...",The Hill,Top,No,15.75484424910959,92.8283666798982,70.68772660881004,82.89585185897134,60.4878802770173,90.14128709930878,ocasio cortez,{},"{'progressives': 'vocal', 'shot': 'long', 'primary': 'democratic'}",1,1
187,Kennedy,2023-07-07,"""US moves ahead with plan to send cluster munitions to Ukraine""","{beacon} Evening Report Friday, July 7 © Getty US sending cluster munitions to Ukraine The Biden administration has approved the transfer of cluster munitions to Ukraine, something Kyiv has long asked for and human rights organizations have spoken out against. The weapons ""are banned by more than 100 countries because the submunitions...",The Hill,Top,No,15.75484424910959,27.31656000701324,99.8698165766332,82.89585185897134,60.4878802770173,90.14128709930878,us plan,{},{'rights': 'human'},1,1
188,Kennedy,2023-07-08,"""When is the optimal time for Biden to drop out of the race?""","If the Democratic National Committee is going to open up the primary to other candidates, the sooner the better.",The Hill,Politics,No,15.77222280300198,79.7228336014924,98.28274778596966,83.31129173299448,84.52688543128824,93.55000511669253,time biden,{'time': 'optimal'},{'candidates': 'other'},1,1
189,Kennedy,2023-07-08,"""David Axelrod says Cornel West poses potential electoral threat to Biden re-election""","Democratic consultant David Axelrod warned that Green Party candidate Cornel West could harm President Biden's re-election bid by pulling away votes toward the progressive academic, thereby helping former President Donald Trump.","The Washington Times , America’s Newspaper",Top,No,15.77222280300198,97.98077602716596,89.32073465361036,83.31129173299448,84.52688543128824,93.55000511669253,david axelrod,{'threat': 'electoral'},"{'consultant': 'democratic', 'academic': 'progressive'}",1,1
190,Kennedy,2023-07-09,"""The Supreme Court’s Tarnished Reputation""","A member of the court’s bar is resigning, and others express their dismay. Also: Groundwater and the Earth’s wobble; politicians as messiahs; helping the homeless.",The New York Times,Business,No,15.73782627614196,29.399757048249853,93.77315895531612,82.48903178696884,49.699530702294155,96.69591928426925,supreme court,{'reputation': 'tarnished'},{'politicians': 'wobble'},0,0
191,Kennedy,2023-07-09,"""DNC chair on third-party candidates: 'This is not the time in order to experiment'""","Democratic National Committee (DNC) Chair Jaime Harrison warned Sunday of the stakes in the upcoming 2024 presidential election and said of third-party candidates, like Cornel West, “This is not the time in order to experiment.” “This is not the time in order to experiment. This is not the time to play around on the margins....",The Hill,Top,No,15.73782627614196,99.90532607786966,99.85905097040478,82.48903178696884,49.699530702294155,96.69591928426925,dnc chair,{'party': 'third'},"{'election': 'presidential', 'party': 'third'}",0,0
192,Kennedy,2023-07-10,"""Biden Announces US Is 'Low' On 155mm Ammunition In Slip Up On National TV""",Conservatives were confused and outraged that Biden announced a shortage of weapons in a nationally-televised interview.,International Business Times,Technology,No,15.749633797885274,99.86062027684348,91.31273185959346,82.77129436047997,72.97888289417178,66.23109855994015,biden announces,{},{'interview': 'televised'},1,1
193,Kennedy,2023-07-10,"""White House Aspirant Owns $250K In Bitcoin, Not His Wife As Previously Claimed""",Kennedy Jr.'s comment about Bitcoin has become less and less frequent following the Miami conference but occasionally mentioned his support for the maiden crypto during the one-on-one interview on Twitter Spaces with tech billionaire Elon Musk in June.,International Business Times,Top,No,15.749633797885274,99.81749317184072,16.130118613697164,82.77129436047997,72.97888289417178,66.23109855994015,white house,{},{},1,1
